Thailand,country,,,,,,
Bangkok,area,A city where the familiar and the exotic collide like the flavours on a plate of pàt tai,600,THB,Bangkok,0,Thailand
Phuket,area,"The pearl of the Andaman, this is Thailand’s original flavour of tailor-made fun in the sun",500,THB,Bangkok,12,Thailand
Pattaya,area,A schizophrenic experience: part package holiday destination; part debauchery centre,800,THB,Bangkok,3,Thailand
Krabi,area,Where rock climbers and castaway vagabonds alike will find their nirvana,400,THB,Phuket,10,Thailand
Koh Phi Phi,area,Thailand’s Shangri-La: a hedonistic paradise where tourists cavort in azure seas and craggy cliffs,500,THB,Phuket,3,Thailand
